who,position,positionLabel,startDate,endDate,replaces,replacesLabel,replacedBy,replacedByLabel,posidx
54366665,,,,,,,,,0
54366665,,Permanent Representative of Venezuela to the United Nations,2017-12-05,,Q2127006,Rafael Ramírez,,,1
54366665,List of Ministers of Foreign Affairs of Venezuela,Minister of Foreign Affairs,2017-06-21,2017-08-02,Delcy Rodriguez,Delcy Rodriguez,Q6623799,Jorge Arreaza,2
54366665,Organization of American States,Ambassador of Venezuela to the Organization of American States,2017-03-27,2019-01-22,,,Gustavo Tarre,Gustavo Tarre,3
54366665,,Minister of University Education,2004,2006,,Fabio Quijada,,Luis Acuña,4
